{
	"$schema": "https://json-schema.org/draft/2020-12/schema",
	"$id": "https://luisz1.github.io/chronus-tabula/schema/evento.json",
	"title": "Evento (datos/eventos/<año>-<nombre>.json)",
	"description": "Hecho puntual que se marca en el mapa en un año (fundación, invento, descubrimiento…). El fichero se llama <año>-<nombre-en-minusculas>.json (años a. C.: '480ac-…').",
	"type": "object",
	"required": [
		"nombre",
		"anio",
		"lat",
		"lng"
	],
	"properties": {
		"id": {
			"type": "string",
			"pattern": "^[a-z0-9-]+$",
			"description": "Identificador estable (minúsculas y guiones): es la clave de sus traducciones en datos/i18n/. No lo cambies al corregir el nombre"
		},
		"nombre": {
			"type": "string",
			"minLength": 1
		},
		"anio": {
			"type": "integer",
			"minimum": -123000,
			"maximum": 2100,
			"description": "Año; negativo = a. C."
		},
		"hasta": {
			"type": [
				"integer",
				"null"
			],
			"minimum": -123000,
			"maximum": 2100,
			"description": "Año (negativo = a. C.) o null/ausente"
		},
		"categoria": {
			"enum": [
				"invento"
			],
			"description": "Hoy solo existe 'invento' (icono distinto); ausente = evento general"
		},
		"lat": {
			"type": "number",
			"minimum": -90,
			"maximum": 90
		},
		"lng": {
			"type": "number",
			"minimum": -180,
			"maximum": 180
		},
		"paises": {
			"type": "array",
			"items": {
				"type": "string"
			},
			"description": "Países o pueblos implicados (texto libre)"
		},
		"descripcion": {
			"type": "string"
		},
		"wiki": {
			"type": "string",
			"minLength": 1,
			"description": "Título del artículo en Wikipedia en español (p. ej. 'Reino de Aragón'); admite prefijo de idioma ('es:…', 'en:…')"
		},
		"fuentes": {
			"type": "array",
			"description": "Toda contribución cita su fuente. 'id': wikipedia-<idioma>:<Título> (p. ej. 'wikipedia-es:Imperio otomano'), wikidata:Q… , libro:/articulo:/mapa:/datos:/web:<clave> de datos/referencias.json, o 'curado' (elaboración propia). 'consultado' es la fecha AAAA-MM o AAAA-MM-DD; 'paginas', las páginas de un libro.",
			"items": {
				"type": "object",
				"required": [
					"id"
				],
				"properties": {
					"id": {
						"type": "string",
						"pattern": "^(wikipedia-[a-z]{2,3}:.+|wikidata:Q[0-9]+|(libro|articulo|mapa|datos|web):[a-z0-9-]+|curado)$"
					},
					"url": {
						"type": "string"
					},
					"licencia": {
						"type": "string"
					},
					"consultado": {
						"type": "string"
					},
					"paginas": {
						"type": "string",
						"description": "Páginas o capítulo (libros y artículos)"
					}
				}
			}
		}
	}
}
