{
	"id": "1789-toma-de-la-bastilla",
	"nombre": "Toma de la Bastilla",
	"anio": 1789,
	"lat": 48.85,
	"lng": 2.37,
	"paises": [
		"Francia"
	],
	"descripcion": "Estalla la Revolución Francesa el 14 de julio de 1789.",
	"wiki": "Toma de la Bastilla",
	"fuentes": [
		{
			"id": "wikipedia-es:Toma de la Bastilla",
			"url": "https://es.wikipedia.org/wiki/Toma_de_la_Bastilla",
			"licencia": "CC BY-SA"
		}
	]
}
