{
	"id": "753ac-fundacion-de-roma-leyenda",
	"nombre": "Fundación de Roma (leyenda)",
	"anio": -753,
	"hasta": -740,
	"lat": 41.89,
	"lng": 12.48,
	"paises": [
		"Roma"
	],
	"descripcion": "Fecha legendaria de la fundación de Roma por Rómulo.",
	"wiki": "Fundación de Roma",
	"fuentes": [
		{
			"id": "wikipedia-es:Fundación de Roma",
			"url": "https://es.wikipedia.org/wiki/Fundación_de_Roma",
			"licencia": "CC BY-SA"
		}
	]
}
