{
	"id": "1923-golpe-de-estado-de-primo-de-rivera",
	"nombre": "Golpe de Estado de Primo de Rivera",
	"anio": 1923,
	"lat": 40.42,
	"lng": -3.7,
	"paises": [
		"España"
	],
	"descripcion": "Pronunciamiento militar que instaura la dictadura del Directorio Militar y suspende el sistema parlamentario.",
	"wiki": "Dictadura de Primo de Rivera",
	"fuentes": [
		{
			"id": "wikipedia-es:Dictadura de Primo de Rivera",
			"url": "https://es.wikipedia.org/wiki/Dictadura_de_Primo_de_Rivera",
			"licencia": "CC BY-SA",
			"consultado": "2026-09-07"
		}
	]
}
